{
  "hyper_parameters":{
    "hidden_layer_size": [80, 100, 120],
    "activation": ["relu", "tanh", "logistic"],
    "solver": ["adam", "sgd", "lbfgs"],
    "learning_rate": ["constant", "invscaling", "adaptive"],
    "learning_rate_init" : [0.001, 0.01, 0.05]
  },
  "average_params":{
    "hidden_layer_size": 80,
    "activation": "relu",
    "solver": "adam",
    "learning_rate": "constant",
    "learning_rate_init" : 0.001
  },
  "generation_number": 1000,
  "number_of_top_classifiers": 5,
  "test_tolerance": 0.03,
  "validation_tolerance": 0.03,
  "is_initial_phase": "Yes",
  "best_classifier_found": "No",
  "test_best_classifier_passed": "No"
}